"35073","民國98年環保署委辦「營運中含鉛製程事業之土壤污染潛勢調查計畫」，本計畫依據96年5月底至7月底間，臺中環境保護局於烏日區（原烏日鄉）同安厝段區域進行4次的土壤採樣作業，依結果公告3筆地號為土壤污染控制場址。農糧署亦於96年11月於該3筆地號採集27組土壤樣品進行重金屬含量檢測，結果發現3組糙米樣品之鉛及鎘濃度均高於「食米重金屬限量標」。為掌握全國高鉛污染潛勢工廠，避免再次發生臺中烏日區同安厝段污染事件，透過本計畫建立臺灣地區鉛之命運期物質流資料庫，篩選十大具較高污染潛勢之含鉛製程，瞭解含鉛製程事業對環境及農作物所造成之影響，釐清污染影響之傳輸途徑，並透過鉛穩定同位素比例分析技術追蹤農地鉛污染之可能來源，另擬訂重金屬及無機陰離子污染之調查整治及驗證等技術手冊，以供作未來管理含鉛製程事業所造成污染之參考指引。"
"35074","全國應定期檢測申報水體底泥品質之單位與水體"
"35075","全國應定期檢測申報水體底泥品質之水體數量"
"35077","沿岸潮位站即時潮位監測資料(未品管)"
"35085","土砂觀測站水位資料"
"35086","土砂觀測站流速資料"
"35087","水庫堰壩基本資料"
"35088","於臺灣周邊海域62測站按季採集水樣，葉綠素甲(Chl-a)分別使用10μm篩絹及0.7μm濾膜，逐級過濾浮游植物後遮光冷凍(-20℃)保存攜回實驗室，將濾後濾膜經90%丙酮低溫萃取14-24小時後，以螢光光度計測定酸化前後的螢光值，計算出海域中葉綠素甲含量。"
"35089","全台灣溫泉點位分布資料"
"35092","台灣本島地下水污染管制區之地理位置.\r\n本空間資訊為工廠、農地、加油站等位址，經調查確認其地下水遭受污染，並經公告其場址管制範圍。"
"35094","全國土壤及地下水污染場址及其面積之累積統計報表"
"35096","沼液沼渣農地肥分使用計畫申請書範例"
"35102","工業區土壤及地下水品質歷年燈號及變換情形說明"
"35104","104年衛星航拍資料"
"35105","系統將回應最新監測數據之XML(最新一小時)"
"35106","系統將回應最新監測數據之XML(最新一小時)"
"35107","系統將回應最新監測數據之XML(最新一小時)"
"35108","系統將回應最新監測數據之XML(最新一小時)"
"35109","系統將回應最新監測數據之XML(最新一小時)"
"35110","系統將回應最新監測數據之XML(最新一小時)"
"35111","系統將回應最新監測數據之XML(最新一小時)"
"35112","統將回應最新監測數據之XML(最新一小時)"
"35113","系統將回應最新監測數據之XML(最新一小時)"
"35114","系統將回應最新監測數據之XML(最新一小時)"
"35115","系統將回應最新監測數據之XML(最新一小時)"
"35116","系統將回應最新監測數據之XML(最新一小時)"
"35117","系統將回應最新監測數據之XML(最新一小時)"
"35118","系統將回應最新監測數據之XML(最新一小時)"
"35119","系統將回應最新監測數據之XML(最新一小時)"
"35120","系統將回應最新監測數據之XML(最新一小時)"
"35121","系統將回應最新監測數據之XML(最新一小時)"
"35122","系統將回應最新監測數據之XML(最新一小時)"
"35123","系統將回應最新監測數據之XML(最新一小時)"
"35124","系統將回應最新監測數據之XML(最新一小時)"
"35125","系統將回應最新監測數據之XML(最新一小時)"
"35126","提供宜蘭縣海域水質監測標準值"
"35127","提供宜蘭縣自辦海域水質監測結果"
"35128","提供宜蘭縣港口水質監測標準值"
"35129","提供宜蘭縣自辦港口水質監測結果"
"35131","空氣品質監測小時值(一般污染物，每日更新)"
"35132","提供宜蘭縣人工空氣品質監測站總懸浮微粒(TSP)監測資料"
"35133","提供宜蘭縣人工空氣品質監測站落塵量監測資料"
"35134","提供宜蘭縣機車排氣定檢站資料"
"35135","提供宜蘭縣電動機車充電站資料"
"35136","提供宜蘭縣加油站資料"
"35137","提供宜蘭縣已補助新購電動二輪車申請案查詢"
"35138","省產闊葉原木市價調查比較"
"35139","省產木材製品市價調查比較"
"35140","省產木材副產品市價調查比較"
"35141","進口針葉原木市價調查比較"
"35142","進口闊葉原木市價調查比較"
"35143","進口木材製品市價調查比較"
"35144","省產針葉原木市價波動價差"
"35145","省產闊葉原木市價波動價差"
"35146","省產木材製品市價波動價差"
"35147","省產木材副產品市價波動價差"
"35148","進口針葉原木市價波動價差"
"35149","進口闊葉原木市價波動價差"
"35150","台灣地區木材市價歷年各月份摘要表"
"35151","木材市價月分別報告表"
"35152","歷年各月份木材市價單一樹種報表"
"35153","全國林火預警資料"
"35155","環保署環境影響評估審查委員會會議紀錄"
"35156","全國申報單位（不含學生和國防單位）有效護照開通率"
"35157","環境教育終身學習網註冊及護照開通人數資料"
"35158","不同屬性單位完成辦理之環境教育次數合計"
"35159","各類環保專責（技術）人員訓練簡章"
"35160","1.土壤污染評估調查人員訓練合格證書申請表\r\n2.空氣污染物及噪音檢查人員合格證書申請表\r\n3.空氣污染防制專責人員訓練合格證書申請表\r\n4.室內空氣品質維護管理專責人員訓練合格證書申請表\r\n5.毒性化學物質專業技術管理人員訓練合格證書申請表\r\n6.廢水處理專責人員訓練合格證書申請表\r\n7.廢棄物清理專業技術人員訓練合格證書申請表\r\n8.環境用藥專業技術人員訓練合格證書申請表"
"35161","不同屬性單位辦理的環境教育辦參與人數合計(要有核過時數的)"
"35162","不同屬性單位辦理環境教育人*時合計(要有核過時數的)"
"35163","環境教育終身學習網內所有的有效護照人數"
"35164","環境教育終身學習網所有的註冊人數(含未開通)"
"35165","本署辦理「環境科技論壇」之論文集資料"
"35166","提供宜蘭縣環保局環保大事記資料"
"35167","提供宜蘭縣環保相關法規"
"35168","提供宜蘭縣環保局招標公告資訊"
"35169","提供宜蘭縣環保局各項計畫執行成果連結"
"35170","提供宜蘭縣公廁基本資料"
"35171","提供宜蘭縣自備環保杯享優惠業者名單"
"35172","提供宜蘭縣飲料販賣業提報減量計畫之優惠方案內容"
"35173","提供宜蘭縣環保局新聞稿及連結"
"35174","提供宜蘭縣噪音監測站名冊資料"
"35175","提供宜蘭縣環保局公務統計報表下載及連結網址"
"35176","提供宜蘭縣有申請廢食用油工作證之合格清除機構"
"35177","提供宜蘭縣廢棄車輛拖吊資料"
"35178","提供宜蘭縣公民營清除處理機構名冊"
"35179","提供宜蘭縣4大水泥廠廢棄物再利用資料"
"35180","提供宜蘭縣再生家具販售目錄"
"35181","提供宜蘭縣社區資源回收站名冊資料"
"35182","提供宜蘭縣已核發應回收廢棄物回收處裡業登記名冊"
"35183","提供宜蘭縣資源回收物分類指引明細表"
"35184","宜蘭縣各鄉鎮市清潔隊廚餘回收分類表"
"35185","宜蘭垃圾車APP程式所建立的宜蘭縣各鄉鎮市垃圾清運點資料"
"35186","提供宜蘭縣綠色商店名冊資料"
"35187","提供宜蘭縣環保旅店名冊"
"35188","提供宜蘭縣交通音量每季監測資料"
"35189","提供宜蘭縣垃圾掩埋場現況表"
"35190","提供宜蘭縣垃圾衛生掩埋場進場量資料"
"35191","提供宜蘭縣水肥清運業者經許可投入水肥處理站名冊"
"35192","提供宜蘭縣環保局各項業務之申辦表單下載資訊及連結網址"
"35200","為最新全台岩屑崩滑潛勢分析圖數值檔。"
"35201","活動斷層位置調查資料之控制點坐標集合。"
"35202","為最新全台順向坡地質圖數值檔。"
"35203","為最新全台落石分布圖數值檔。"
"35204","為最新全台地質鑽探點位資料數值檔。"
"35205","全國各鄉鎮土石流潛勢溪流警戒資料"
"35206","提供宜蘭縣自來水水質監測與指標資料"
"35207","提供宜蘭縣地下水監測井基本資料"
"35208","提供宜蘭縣垃圾衛生掩埋場地下水監測值及基準值"
"35209","提供宜蘭縣垃圾衛生掩埋場地下水監測井位置資料"
"35210","提供宜蘭縣垃圾衛生掩埋場歷年地下水監測結果"
"35247","提供宜蘭縣一般地區環境音量每季監測資料"
"35258","歲入來源別預算表、歲出機關別預算表、歲入項目說明提要表、歲出計畫提要及分支計畫概況表、各項費用彙計表、歲出一級用途別科目分析表、資本支出分析表、人事費分析表、預算員額明細表、公務車輛明細表、現有辦公房舍明細表、轉帳收支對照表、捐助經費分析表、派員出國計畫預算總表、派員出國計畫預算類別表－開會、談判、派員赴大陸計畫預算類別表、歲出按職能及經濟性綜合分類表。"
"35285","機關於文化部典藏網之目錄資訊"
"35286","機關於文化部典藏網之目錄資訊"
"35288","機關於文化部典藏網之目錄資訊\n"
"35289","機關於文化部典藏網之目錄資訊\n"
"35290","機關於文化部典藏網之目錄資訊\n"
"35291","機關於文化部典藏網之目錄資訊"
"35292","機關於文化部典藏網之目錄資訊\n"
"35293","機關於文化部典藏網之目錄資訊\n"
"35294","機關於文化部典藏網之目錄資訊\n"
"35295","機關於文化部典藏網之目錄資訊\n"
"35298","機關於文化部典藏網之目錄資訊\n"
"35299","機關於文化部典藏網之目錄資訊\n"
"35300","機關於文化部典藏網之目錄資訊\n"
"35303","機關於文化部典藏網之目錄資訊\n"
"35313","106年度行政院農業委員會特有生物研究保育中心單位預算資料"
"35317","茶業改良場單位預算"
"35324","臺鐵歷年員工性別結構統計"
"35325","行李包裹損害賠償額"
"35329","工作站\t監視點編號\t監視點名稱\t採樣日期\t採樣狀況\t氣候狀況\t水溫(℃)\tpH值(-)\t電導度(μS/cm25℃)\t溶氧(mg/L"
"35330","工作站\t監視點編號\t監視點名稱\t採樣日期\t採樣狀況\t氣候狀況\t水溫(℃)\tpH值(-)"
"35332","工作站監視點編號監視點名稱採樣日期檢驗日期水溫(℃)pHEC(μS/cm)SS(mg/L)Cl-(mg/L)SO42-(mg/L)NH4N"
"35333","工作站監視點名稱採樣日期水質"
"35339","106年度行政院農業委員會高雄區農業改良場單位預算"
"35341","歲入來源別預算表、歲出機關別預算表、歲入項目說明提要表、歲出計畫提要及分支計畫概況表、各項費用彙計表、歲出一級用途別科目分析表、資本支出分析表、人事費分析表、預算員額明細表、公務車輛明細表、現有辦公房舍明細表、收支併列案款對照表、補助經費分析表、捐助經費分析表、派員出國計畫預算總表、派員出國計畫預算類別表－考察、視察、訪問、派員出國計畫預算類別表－開會、談判、派員出國計畫預算類別表－進修、研究、實習、派員赴大陸計畫預算類別表、歲出按職能及經濟性綜合分類表、跨年期計畫概況表、委辦經費分析表"
"35348","臺中市政府全球資訊中文網市政新聞"
"35349","臺中市政府全球資訊中文網機關訊息"
"35350","臺中市政府全球資訊中文網活動訊息"
"35354","歲入來源別預算表、歲出機關別預算表、歲入項目說明提要表、歲出計畫提要及分支計畫概況表、各項費用彙計表、歲出一級用途別科目分析表、資本支出分析表、人事費分析表、預算員額明細表、公務車輛明細表、現有辦公房舍明細表、轉帳收支對照表、捐助經費分析表、派員出國計畫預算總表、派員出國計畫預算類別表－開會、談判、派員出國計畫預算類別表－進修、研究、實習、歲出按職能及經濟性綜合分類表、跨年期計畫概況表、委辦經費分析表"
"35355","歲入來源別預算表、歲出機關別預算表、歲入項目說明提要表、歲出計畫提要及分支計畫概況表、各項費用彙計表、歲出一級用途別科目分析表、資本支出分析表、人事費分析表、預算員額明細表、公務車輛明細表、現有辦公房舍明細表、收支併列案款對照表、捐助經費分析表、派員出國計畫預算總表、派員出國計畫預算類別表－考察、視察、訪問、派員出國計畫預算類別表－開會、談判、派員出國計畫預算類別表－進修、研究、實習、歲出按職能及經濟性綜合分類表"
"35360","機關於文化部典藏網之目錄資訊\n"
"35373","提供使用者查詢毒性化學物質運送車輛即時監控系統之車機型號每月妥善率，資料內容包含：年份、月份、車機廠牌批次、妥善率等級"
"35374","提供環保機關已核發之乾電池汞、鎘含量確認文件資料(電池資料、有效期限、汞鎘含量、電池外觀照片)，以供查詢電池是否已合法申請確認文件。"
"35376","提供衛服部再利用試驗計畫、個案再利用、通案及再利用機構登記檢核資料，包括機構基本資料、再利用廢棄物種類、再利用量及有效期限。"
"35377","彙整各工業區各年度申報狀態報表，資料包括檢測內容及其各單位審核內容等資訊"
"35378","應回收廢棄物稽核認證行程之資料(稽核日期、時間、項目、地點、業者名稱、稽核團體、稽核方式等)"
"35381","勞務採購契約書範本,財務採購契約書範本,資訊服務採購契約範本,公共工程技術服務契約書範本,公共工程專案管理契約書範本"
"35480","工作站\t監視點編號\t監視點名稱\t採樣日期\t檢驗日期\t水溫(℃)\tpH\tEC(μS/cm)\tSS(mg/L)"
"35481","工作站\t監視點編號\t監視點名稱\t採樣日期\t檢驗日期\t水溫(℃)\tpH\tEC(μS/cm)\tSS(mg/L)\tCl-(mg/L)"
"35482","工作站\t監視點編號\t監視點名稱\t採樣日期\t檢驗日期\t水溫(℃)\tpH\tEC(μS/cm)\tSS(mg/L)\tCl-(mg/L)"
"35483","工作站\t監視點編號\t監視點名稱\t採樣日期\t採樣狀況\t氣候狀況\t檢測項目\t水質結果判定(合格/不合格)水溫(℃)\tpH值(-)\t電導度(μS/cm25℃)\t溶氧(mg/L)"
"35484","工作站\t監視點編號\t監視點名稱\t採樣日期\t檢驗日期\t項目\t水溫\tpH值\t電導度(EC)\t溶氧(DO)\t懸浮固體(SS)\t氯化物(CL-)\t硫酸鹽(SO42-)\t總氮量(T-N)"
"35485","工作站\t監視點編號\t監視點名稱\t採樣日期\t檢驗日期\t項目\t水溫\tpH值\t電導度(EC)\t溶氧(DO)\t懸浮固體(SS)\t氯化物(CL-)\t硫酸鹽(SO42-)\t總氮量(T-N)"
"35496","106年度行政院農業委員會林務局單位預算"
"35504","文化部收錄之街頭藝人展演空間資訊"
"35505","提供文化部整合本部及所屬各級機關(構)以及其他公、民營單位之新住民主題區未過期藝文活動資訊"
"35507","文化部收錄各縣市街頭藝人之資訊"
"35526","本資料集為文化部影視及流行音樂產業局之影視局國片暨紀錄片影像教育扎根計畫網站之最新消息資訊"
"35527","本資料集為文化部影視及流行音樂產業局之影視局國片暨紀錄片影像教育扎根計畫網站之課程資訊"
"35550","歲入來源別預算表、歲出機關別預算表、歲入項目說明提要表、歲出計畫提要及分支計畫概況表、各項費用彙計表等"
"35551","歲入類、經費類平衡表：資力及資產科目及金額、負擔及負債科目及金額；歲入類、經費類現金出納表：項目及摘要、總計；歲入類累計表：科目、原預算數、預算追加(減)數、全年度預算數、截至本月止分配預算數、收入憑證字號、本月實收數、截至本月止累計實收數、應收數、保留數、未收入之分配數、本月納庫數、累計納庫數截至本月止；經費累計表：科目、原預算數、預算追加(減)數、第一預備金、第二預備金、經費流用數、全年度預算數、截至本月止分配預算數、原始憑證字號、本月實現數、截至本月止累計實現數、應付數、保留數、分配數餘額、備註"
"35552","決議、附帶決議及注意事項、辦理情形"
"35553","歲入來源別預算表、歲出機關別預算表：本年度預算數、上年度預算數、前年度決算數、本年度與上年度比較、說明等。歲入項目說明提要表、歲出計畫提要及分支各項費用彙計表、歲出一級用途別科目分析表、資本支出分析表、人事費分析表、預算員額明細表、公務車輛明細表、現有辦公房舍明細表、補助經費分析表、捐助經費分析表、派員出國計畫預算總表、派員出國計畫預算類別表-考察、視察、訪問、開會、談判、派員赴大陸計畫預算類別表、歲出按職能及經濟性綜合分類表、跨年期計畫概況表、委辦經費分析表：名稱、金額。等"
"35555","臺灣鄰近及遠洋漁業海面天氣預報資料"
"35556","預算別、機關名稱、補助對象、直轄市或縣市別、計畫名稱、核定日期、核定金額、備註(工作計畫)"
"35557","提供宜蘭縣人工空氣品質監測站基本資料"
"35567","公文線上簽核比率"
"35568","公文歸檔案件統計"
"35570","提供資料包含：步道編號、步道名稱、步道分級、步道系統、子步道系統、管理單位、步道入口等欄位資訊。本資料集所提供之森林步道資訊僅供參考，步道服務現況請依原始資料來源網站為準。"
"35571","提供林務局所轄18個國家森林遊樂區之園區基本資料，資料來源為「台灣山林悠遊網」之即時資訊(http://recreation.forest.gov.tw)。"
"35572","水利署政府出版品書目"
"35573","雲林縣綠色商店清單"
"35585","全國各地土石流警報資料，此資料項於防汛期間為6小時更新一次，不定期3小時補充加報，若發布內容為空白資料時，即代表警報解除，且此資料為土石流潛勢溪流之資料內容統計彙整，若警報解除時，土石流潛勢溪流之資料內容即無顯著義意，亦不再更新"
"35590","水利事業歷史用地取得作業執行情形"
"35591","自來水生活用水量統計"
"35592","每年提供臺灣地區水資源投資額與資本形成、生產毛額等經濟性數據相除計算之結果，並可得到該年度平均每人水資源投資額之數據供參考"
"35593","自來水水質水量保護區公告資料，包括公告日期、公告面積以及涵蓋範圍資訊。"
"35594","本資料集主要提供全台灣水利署所掌管之最新各中央管河川疏濬資訊，包括疏濬規劃量與目前執行量等相關資訊。"
"35597","經確認後之全國土石流災情資料"
"35637","歲入來源別決算表：科目、名稱及編號、原預算數、預算增減數、預算數合計、決算實現數、應收數、保留數、決算數合計;歲出政事別、機關別決算表：科目、名稱及編號、原預算數、預算追加(減)數、動支第一預備金數、動支第二預備金數、經費流用數、預算調整數、預算調整數小計、實現數、應付數、保留數、決算數合計;以前年度歲出政事別、機關別轉入數決算表：科目、名稱及編號、以前年度轉入數、本年度減免（註銷）數、本年度實現數、本年度調整數、本年度未結清數;歲入類、經費類平衡表：資產科目及編號及金額、負債科目及編號及金額"
"35643","提供資料包括：會別、年別、灌溉用水量、期作等欄位資料。"
"35644","提供資料包括：會別、年別、灌溉用水量、期作等欄位資料。"
"35646","提供資料包括：會別、年別、灌溉滿足度、期作等欄位資料。"
"35651","新竹市政府市政新聞資料"
"35652","提供民眾了解市政推動的過程"
"35653","新竹市政府網路申辦項目相關資料，含受理網路申辦項目之機關(單位)、申辦項目"
"35654","新竹市政府1999服務專線每月來電總數"
"35655","iHsinchu熱點流量統計一覽表"
"35656","新竹市政府1999服務專線熱門問答點閱數排名"
"35657","本府各單位規費提供市民卡(含悠遊卡)小額電子支付付費使用統計數據"
"35658","提供本市iHsinchu免費無線上網熱點地點資訊,方便大家利用."
"35659","新竹市各電影院基本資料"
"35660","新竹市轄內有線廣播電視系統經營者資料"
"35661","營業基金及非營業特種基金盈虧（餘絀）"
"35662","歲出預算-按政事別"
"35663","歲入決算-按來源別"
"35664","歲出決算-按政事別"
"35665","歲入預算-按來源別"
"35666","行政院主計總處-家庭收支調查報告"
"35667","新竹市政府104年度對民間團體補(捐)助經費明細表"
"35668","新竹市政府104年度對議員所提地方建設建議事項處理明細表"
"35669","新竹市政府對議員所提地方建設建議事項處理明細表"
"35670","新竹市政府105年至6月底對民間團體補(捐)助經費明細表"
"35671","新竹市公立納骨堂清冊可供查詢資料欄位有殯葬設施名稱連絡電話傳真地址"
"35672","新竹市私立納骨堂清冊可供查詢資料欄位有殯葬設施名稱連絡電話傳真地址"
"35673","新竹市政府許可備查合法殯葬業者名冊可供查詢資料欄位有殯葬業者名稱負責人統一編號許可狀態營業住址電話鄉鎮市區別"
"35674","屆別、姓名、職稱、性別、區別、里別、通訊地址、市內電話、行動電話"
"35675","臺閩地區役政單位連絡、傳真電話一覽表"
"35676","新兵入營訓練中心"
"35677","序號、里集會所名稱、管理單位、聯絡人、聯絡電話、集會所地址、緯度、經度、圖片URL"
"35678","提供新竹市各區里鄰數、戶數、性別、人口數、遷出入人數、出生人數、死亡人數、結離婚對數及原住民人數"
"35679","新竹市寺廟名冊可供查詢資料欄位有寺廟名稱主祀神像教別組織型態寺廟所在地寺廟電話"
"35680","編號新竹市教會堂名冊可供查詢資料欄位有教會堂名稱董事長主事務所地址電話設立許可日期"
"35681","新竹市觀光工廠相關資訊"
"35682","新竹市創意風格產業店家名冊"
"35683","提供本市工廠廠商名冊查詢"
"35684","新竹市公有市場，委外經營市場資料。"
"35685","新竹市各攤集區"
"35686","新竹市受保護樹木清冊"
"35691","為利漁業事務聯絡建立聯絡資訊"
"35692","野生動物保護區"
"35693","提供本市商業名冊查詢"
"35694","新竹市漁船筏數量"
"35695","新竹市自來水管承裝商相關資訊"
"35696","新竹市電器承裝商相關資訊"
"35697","新竹市加油(氣)站相關資訊"
"35698","新竹市政府政風處暨所屬政風機構人員統計"
"35699","新竹市政府廉政倫理事件統計"
"35700","每月10日公告前1個月債務資訊"
"35701","揭露新竹市酒製造業者等相關資料，俾供消費者洽詢或申訴等事宜，以維護其權益。"
"35704","提供104年市有財產總值資料(依據104年度決算數編製)"
"35705","新竹市幼兒園名錄"
"35706","提供新竹市終身教育學習地圖資料查詢"
"35707","新竹市立國中小通訊資料"
"35708","新竹市國小學區劃分"
"35709","新竹市國中學區劃分"
"35710","新竹市各學年度國民小學普通班班級數及學生人數"
"35711","新竹市各學年度國民中學普通班班級數及學生人數"
"35712","提供本市公共圖書館名冊及通訊方式查詢"
"35713","參觀資訊"
"35714","考取或持有(憑外縣市有效證照換證)新竹市街頭藝人證照之名單"
"35715","新竹市演藝團體登記立案自90年起移由文化局管轄，本資料係90年至104年登記立案之職業及業餘演藝團體列表。"
"35716","表列新竹市各類文化資產名稱,項目,公告日期等基本資料"
"35717","新竹市博物館群基本資料"
"35718","新竹市玻璃工藝創作者一覽表"
"35719","新竹市公共圖書館每月書籍借閱量"
"35720","新竹市公共圖書館每年圖書預算及採購冊數"
"35721","新竹市家戶垃圾收運定時定點併沿線垃圾清運彙整總表"
"35722","新竹市環保旅店資訊"
"35723","新竹市綠色商店資訊"
"35724","領有本市核可病媒防治業許可執照業者"
"35725","新竹市空氣品質人工監測站數據資料"
"35726","新竹市機車排氣檢驗站"
"35727","電動機車充電站位置一覽表"
"35728","新竹市噪音管制區"
"35729","新竹市環保局柴油車排煙檢測站地址及聯絡電話"
"35730","公司名稱\t區域\t登記地址\t聯絡電話\t貯存地址(廠址)\t登記證證號\t回收項目\t備註"
"35731","領有新竹市廢食用油工作證之清除機構"
"35732","設籍新竹市轄內清除機構名稱及相關資料"
"35733","新竹市河川水質監測資料數據"
"35734","新竹市農地土壤監測資料"
"35735","新竹市河川測站"
"35736","本府環境影響評估審查委員會委員名單，每2年重新改選1次"
"35737","新竹市各醫療機構之住址、電話"
"35738","新竹市護理之家名冊"
"35739","新竹市產後護理之家名冊"
"35740","新竹市AED設置地點"
"35741","新竹市高齡友善銀行地點及連絡電話"
"35742","新竹市依法設置哺集乳室名冊通訊錄資料(單位名稱、地址、電話)"
"35743","新竹市門診戒菸合約醫療院所通訊錄資料(單位名稱、地址、電話)"
